Timestamp,Content
"April 1, 2025, 08:00 PDT","$NVDA down 1% to $112.50, tariff fears hit tech. AI demand keeps me bullish long-term."
"April 1, 2025, 12:35 PDT","Tariffs could crush $NVDA’s margins, stock at $112. Bearish until trade talks clear."
"April 2, 2025, 07:45 PDT","$NVDA drops 8% to $103.50 on Trump tariff news. I’m buying this dip for $120."
"April 2, 2025, 14:05 PDT","$NVDA’s stock at $103, oversold with RSI at 28. Bullish for a bounce pre-earnings."
"April 3, 2025, 09:00 PDT","$NVDA down 5% to $98.30, tech rout continues. Blackwell chip demand still strong."
"April 3, 2025, 15:35 PDT","$NVDA’s stock at $98, tariff risks overblown. Neutral, waiting for Q1 earnings."
"April 4, 2025, 08:15 PDT","$NVDA flat at $98, Huawei’s AI chip rumors swirl. Bullish on NVIDIA’s GPU dominance."
"April 4, 2025, 13:50 PDT","$NVDA’s stock at $98, China exposure worries. Bearish short-term, holding for AI."
"April 5, 2025, 10:20 PDT","$NVDA’s data center revenue up 80% YoY, stock at $98. Bullish for $130 target."
"April 5, 2025, 16:10 PDT","$NVDA’s stock at $98, no breakout yet. Neutral, need tariff relief or earnings."
"April 6, 2025, 09:15 PDT","$NVDA up 2% to $100, tariff fears ease slightly. Bullish if it breaks $105."
"April 6, 2025, 14:40 PDT","$NVDA’s stock at $100, high P/E at 38 is risky. Bearish until Q1 shows growth."
"April 7, 2025, 08:25 PDT","$NVDA down 3% to $97, tech sector weak. AI chip demand keeps me in for $120."
"April 7, 2025, 13:45 PDT","$NVDA’s stock at $97, oversold. I’m buying for a rally to $110 pre-earnings."
"April 8, 2025, 08:40 PDT","$NVDA jumps 6% to $103 on tariff pause rumors. Bullish if AI momentum holds."
"April 8, 2025, 15:20 PDT","$NVDA’s stock at $103, overbought post-rally. Neutral, waiting for a dip."
"April 9, 2025, 09:10 PDT","$NVDA down 4% to $99, Huawei chip news hits. I’m holding for Blackwell upside."
"April 9, 2025, 14:55 PDT","$NVDA’s stock at $99, tariff risks cap gains. Bearish until Q1 earnings clarity."
"April 10, 2025, 08:30 PDT","$NVDA up 3% to $102, Oracle deploys Blackwell GPUs. Bullish for $115."
"April 10, 2025, 13:25 PDT","$NVDA’s stock at $102, volatile on trade news. Neutral, focus on Q1 results."
"April 11, 2025, 09:05 PDT","$NVDA flat at $102, market’s quiet. Bullish on AI chip market share."
"April 11, 2025, 15:30 PDT","$NVDA’s stock at $102, tariff talks drag. Bearish short-term, holding long."
"April 12, 2025, 08:45 PDT","$NVDA’s stock at $102, data center growth solid. Bullish for $120 by Q1."
"April 12, 2025, 14:15 PDT","$NVDA flat at $102, no clear catalyst. Neutral, waiting for earnings spark."
"April 13, 2025, 09:20 PDT","$NVDA up 1% to $103, AI demand surges. Bullish if it breaks $110."
"April 13, 2025, 15:00 PDT","$NVDA’s stock at $103, Huawei competition looms. Bearish until Q1 beat."
"April 14, 2025, 08:50 PDT","$NVDA down 2% to $101, tariff noise back. Neutral, focus on AI growth."
"April 14, 2025, 13:40 PDT","$NVDA’s stock at $101, oversold. Bullish for a bounce to $108 soon."
"April 15, 2025, 08:35 PDT","$NVDA up 4% to $105, Morgan Stanley calls it a top pick. Bullish for $130."
"April 15, 2025, 14:10 PDT","$NVDA’s stock at $105, tariff risks linger. Bearish short-term, holding."
"April 16, 2025, 09:25 PDT","$NVDA down 1% to $104, tech sector soft. Bullish on Blackwell adoption."
"April 16, 2025, 15:15 PDT","$NVDA’s stock at $104, high valuation concerns. Neutral, need Q1 clarity."
"April 17, 2025, 08:20 PDT","$NVDA flat at $104, Q1 earnings in focus. Bullish if revenue beats $43B."
"April 17, 2025, 14:45 PDT","$NVDA’s stock at $104, Huawei chip threat overblown. Neutral, waiting."
"April 18, 2025, 09:30 PDT","$NVDA up 2% to $106, AI chip demand strong. Bullish for $125 target."
"April 18, 2025, 15:05 PDT","$NVDA’s stock at $106, tariff fears persist. Bearish until trade resolution."
"April 19, 2025, 08:55 PDT","$NVDA’s stock at $106, data center growth at 80%. Bullish for $130."
"April 19, 2025, 14:25 PDT","$NVDA flat at $106, market’s cautious. Neutral, need earnings catalyst."
"April 20, 2025, 09:10 PDT","$NVDA’s stock at $106, no major news. Neutral, waiting for Q1 results."
"April 20, 2025, 15:50 PDT","$NVDA’s AI leadership unmatched, stock at $106. Bullish long-term."
"April 21, 2025, 08:15 PDT","$NVDA down 3% to $103, tariff talks heat up. I’m holding for $120."
"April 21, 2025, 13:30 PDT","$NVDA’s stock at $103, oversold pre-earnings. Bullish for a rally."
"April 22, 2025, 09:00 PDT","$NVDA up 5% to $108, tariff relief hopes. Bullish if it breaks $115."
"April 22, 2025, 14:20 PDT","$NVDA’s stock at $108, volatile on trade news. Neutral, focus on Q1."
"April 23, 2025, 08:40 PDT","$NVDA flat at $108, Q1 earnings loom. Bullish if EPS beats $6.12."
"April 23, 2025, 15:10 PDT","$NVDA’s stock at $108, Huawei chip concerns. Bearish short-term."
"April 24, 2025, 09:15 PDT","$NVDA up 3% to $111, Oracle’s Blackwell deal boosts. Bullish for $130."
"April 24, 2025, 14:50 PDT","$NVDA’s stock at $111, tariff risks cap upside. Neutral, waiting for Q1."
"April 25, 2025, 08:30 PDT","$NVDA up 5% to $117, bounces off $87 support. Bullish on AI demand."
"April 25, 2025, 15:00 PDT","$NVDA’s stock at $117, overbought post-rally. Neutral, need Q1 beat."
"April 26, 2025, 09:05 PDT","$NVDA’s stock at $117, data center revenue key. Bullish for $140."
"April 26, 2025, 14:35 PDT","$NVDA flat at $117, Huawei AI chip news. Bearish until earnings."
"April 27, 2025, 08:50 PDT","$NVDA’s stock at $117, Wall St. targets $168. Bullish despite volatility."
"April 27, 2025, 14:15 PDT","$NVDA’s stock at $117, tariff uncertainty weighs. Neutral, focus on Q1."
"April 28, 2025, 09:20 PDT","$NVDA down 2% to $108.73, Huawei chip threat. Bullish on AI leadership."
"April 28, 2025, 14:00 PDT","$NVDA’s stock at $109, momentum bearish. Neutral, waiting for Q1."
"April 29, 2025, 09:45 PDT","$NVDA up 0.5% to $108.86, choppy on chip export rules. Bullish long-term."
"April 29, 2025, 12:30 PDT","$NVDA’s stock at $109, Huawei’s AI chip looms. Bearish short-term, holding."
"March 1, 2025, 08:00 PDT","$NVDA up 2% to $115.00, Blackwell chip demand soars. Bullish despite tariff risks."
"March 1, 2025, 12:30 PDT","$NVDA’s stock at $115, Huawei competition weighs. Bearish short-term, holding."
"March 2, 2025, 07:45 PDT","$NVDA flat at $115, no major news. Neutral, focus on Q1 earnings."
"March 2, 2025, 14:00 PDT","$NVDA’s $39.3B Q4 revenue up 78% YoY, stock at $115. Bullish on AI."
"March 3, 2025, 09:00 PDT","$NVDA down 3% to $111.50, tariff fears hit tech. I’m buying for $125."
"March 3, 2025, 15:15 PDT","$NVDA’s stock at $112, oversold. Bullish for a bounce to $120."
"March 4, 2025, 08:10 PDT","$NVDA up 4% to $116.50, Oracle’s Blackwell deal. Bullish for $130."
"March 4, 2025, 13:40 PDT","$NVDA’s stock at $117, tariff risks linger. Bearish short-term."
"March 5, 2025, 09:50 PDT","$NVDA flat at $117, market’s quiet. Neutral, waiting for Q1 results."
"March 5, 2025, 16:00 PDT","$NVDA’s stock at $117, AI chip dominance grows. Bullish for $140."
"March 6, 2025, 08:20 PDT","$NVDA down 1% to $115.50, Huawei chip concerns. Bearish until Q1."
"March 6, 2025, 14:05 PDT","$NVDA’s stock at $116, support at $110. Bullish if it holds."
"March 7, 2025, 09:10 PDT","$NVDA up 3% to $119.50, AI demand strong. Bullish for $135."
"March 7, 2025, 15:20 PDT","$NVDA’s stock at $120, volatile on news. Neutral, focus on Q1 beat."
"March 8, 2025, 08:30 PDT","$NVDA’s stock at $120, data center growth soars. Bullish for $150."
"March 8, 2025, 14:45 PDT","$NVDA flat at $120, tariff risks cap gains. Bearish short-term."
"March 9, 2025, 09:00 PDT","$NVDA down 4% to $115.00, tech sell-off hits. I’m holding for $130."
"March 9, 2025, 15:10 PDT","$NVDA’s stock at $115, oversold. Bullish for a rally to $125."
"March 10, 2025, 08:40 PDT","$NVDA up 2% to $117.50, AI chip orders soar. Bullish for $145."
"March 10, 2025, 13:50 PDT","$NVDA’s stock at $118, Huawei risks linger. Bearish until Q1 results."
"March 11, 2025, 09:05 PDT","$NVDA flat at $118, no clear driver. Neutral, waiting for earnings."
"March 11, 2025, 14:25 PDT","$NVDA’s Q1 outlook at $43B, stock at $118. Bullish on margins."
"March 12, 2025, 08:55 PDT","$NVDA down 2% to $115.50, tech sector soft. I’m buying for $135."
"March 12, 2025, 14:15 PDT","$NVDA’s stock at $116, oversold pre-earnings. Bullish for a rally."
"March 13, 2025, 09:20 PDT","$NVDA up 5% to $121.50, tariff optimism lifts. Bullish for $155."
"March 13, 2025, 15:00 PDT","$NVDA’s stock at $122, volatile on news. Neutral, focus on Q1."
"March 14, 2025, 08:25 PDT","$NVDA flat at $122, Q1 earnings in focus. Bullish if EPS beats $6.12."
"March 14, 2025, 14:35 PDT","$NVDA’s stock at $122, tariff risks remain. Bearish short-term."
"March 15, 2025, 09:15 PDT","$NVDA’s stock at $122, AI chip leadership strong. Bullish for $160."
"March 15, 2025, 15:30 PDT","$NVDA flat at $122, no catalyst. Neutral, waiting for earnings."
"March 16, 2025, 08:50 PDT","$NVDA up 3% to $125.50, Blackwell adoption grows. Bullish for $170."
"March 16, 2025, 14:20 PDT","$NVDA’s stock at $126, high P/E worries. Neutral, need Q1 clarity."
"March 17, 2025, 09:00 PDT","$NVDA down 1% to $124.00, tech sector soft. Bearish until Q1."
"March 17, 2025, 14:45 PDT","$NVDA’s stock at $124, oversold. Bullish for a bounce to $135."
"March 18, 2025, 08:35 PDT","$NVDA up 2% to $126.50, AI demand hype. Bullish for $180."
"March 18, 2025, 15:05 PDT","$NVDA’s stock at $127, tariff fears persist. Neutral, waiting for Q1."
"March 19, 2025, 09:10 PDT","$NVDA flat at $127, market’s quiet. Bullish on AI long-term."
"March 19, 2025, 14:30 PDT","$NVDA’s stock at $127, Huawei concerns weigh. Bearish short-term."
"March 20, 2025, 08:45 PDT","$NVDA down 2% to $124.00, tech sell-off. I’m holding for $150."
"March 20, 2025, 13:55 PDT","$NVDA’s stock at $124, support at $120. Bullish if it holds."
"March 21, 2025, 09:25 PDT","$NVDA up 6% to $131.50, Q1 outlook optimism. Bullish for $190."
"March 21, 2025, 14:50 PDT","$NVDA’s stock at $132, overbought. Neutral, waiting for pullback."
"March 22, 2025, 08:40 PDT","$NVDA’s stock at $132, AI chip dominance grows. Bullish for $200."
"March 22, 2025, 14:10 PDT","$NVDA flat at $132, tariff talks drag. Bearish short-term."
"March 23, 2025, 09:05 PDT","$NVDA down 3% to $128.00, Huawei chip fears. Neutral, holding."
"March 23, 2025, 15:20 PDT","$NVDA’s stock at $128, oversold. Bullish for a rally to $140."
"March 24, 2025, 08:30 PDT","$NVDA up 2% to $130.50, AI chip news. Bullish for $195."
"March 24, 2025, 14:00 PDT","$NVDA’s stock at $131, tariff risks cap upside. Neutral, waiting."
"March 25, 2025, 09:15 PDT","$NVDA flat at $131, Q1 earnings loom. Bullish if margins strong."
"March 25, 2025, 14:40 PDT","$NVDA’s stock at $131, Huawei concerns linger. Bearish short-term."
"March 26, 2025, 08:55 PDT","$NVDA up 1% to $132.50, AI chip hype. Bullish for $205."
"March 26, 2025, 14:15 PDT","$NVDA’s stock at $133, volatile on news. Neutral, focus on Q1."
"March 27, 2025, 09:00 PDT","$NVDA down 2% to $130.00, tech sector soft. I’m buying for $160."
"March 27, 2025, 15:25 PDT","$NVDA’s stock at $130, oversold. Bullish for a bounce to $140."
"March 28, 2025, 08:20 PDT","$NVDA up 4% to $135.00, tariff relief hopes. Bullish for $210."
"March 28, 2025, 13:45 PDT","$NVDA’s stock at $135, overbought post-rally. Neutral, waiting for Q1."
"March 29, 2025, 09:10 PDT","$NVDA’s stock at $135, AI chip orders soar. Bullish for $220."
"March 29, 2025, 14:35 PDT","$NVDA flat at $135, market’s cautious. Neutral, need Q1 beat."
"March 30, 2025, 08:50 PDT","$NVDA down 1% to $133.50, tariff noise back. Bearish short-term."
"March 30, 2025, 14:20 PDT","$NVDA’s stock at $134, support at $130. Bullish if it holds."
"March 31, 2025, 09:05 PDT","$NVDA up 0.5% to $134.50, Q1 anticipation. Bullish for $230."
"March 31, 2025, 12:10 PDT","$NVDA’s stock at $135, tariff risks linger. Neutral, waiting for Q1."