Timestamp,Content
"April 1, 2025, 08:15 PDT","$TSLA deliveries down 13% in Q1, worst since 2022. Stock’s holding up, but I’m worried about margins."
"April 1, 2025, 10:22 PDT","Tesla’s Q1 numbers are rough, but $TSLA still up 1.5% today. Market’s betting on Musk’s next move."
"April 2, 2025, 08:24 PDT","$TSLA up 2.6% after Trump says Musk might leave DOGE. Investors hyped for Musk’s focus on Tesla."
"April 2, 2025, 09:37 PDT","$TSLA’s a meme stock, valued on Musk’s “genius” myth. His lies make me doubt its worth."
"April 3, 2025, 07:50 PDT","$TSLA deliveries miss big, but stock’s not crashing. AI and robotaxi bets are keeping it afloat."
"April 3, 2025, 12:18 PDT","Analysts slamming $TSLA after Q1, but I’m still bullish. Model Q and autonomy will drive gains."
"April 4, 2025, 09:10 PDT","$TSLA down 3% today, feeling the Q1 delivery pain. Musk needs to deliver on robotaxi promises."
"April 4, 2025, 14:25 PDT","$TSLA’s brand is hurting from Musk’s politics. Stock’s volatile, but I’m holding for long-term."
"April 5, 2025, 10:05 PDT","$TSLA’s Q1 was bad, but energy biz is growing fast. Stock could rebound if AI narrative sticks."
"April 5, 2025, 16:30 PDT","$TSLA’s P/E ratio is nuts compared to BYD. Bearish until they show real profit growth."
"April 6, 2025, 11:21 PDT","Wedbush cuts $TSLA target to $315, citing brand damage. Still bullish on autonomy, though."
"April 6, 2025, 13:40 PDT","$TSLA’s downtrend continues, but retail’s buying dips. Could be a trap or a bottom soon."
"April 7, 2025, 08:30 PDT","$TSLA’s stock is oversold, technicals screaming buy. I’m in for a bounce this week."
"April 7, 2025, 15:12 PDT","Musk’s XAI raise could distract from $TSLA. Stock’s shaky, bearish vibes growing stronger."
"April 8, 2025, 07:05 PDT","$TSLA reshored more than any OEM, yet Navarro criticizes it. Tesla’s jobs should boost stock."
"April 8, 2025, 09:09 PDT","$TSLA up 5.12% today, closing at $245.24. Musk’s active leadership is sparking some hope."
"April 9, 2025, 16:00 PDT","$TSLA up 23% today, best day since 2013! Tariff pause from Trump is rocket fuel for stock."
"April 9, 2025, 17:53 PDT","$TSLA’s stuck near 52-week lows, bearish sentiment everywhere. Short volume at multi-year highs."
"April 10, 2025, 12:37 PDT","$TSLA’s in long-term decline, Waymo’s ahead in self-driving. Musk’s politics hurt the brand."
"April 10, 2025, 13:20 PDT","$TSLA drops 7.3% after yesterday’s 23% surge. Market’s volatile, tariff news still driving."
"April 11, 2025, 09:45 PDT","$TSLA’s volatility is insane, but I’m buying dips. Robotaxi news could send it to $300."
"April 11, 2025, 14:50 PDT","$TSLA’s forward P/E is too high for an automaker. Bearish until they prove AI revenue."
"April 12, 2025, 10:15 PDT","$TSLA’s energy storage biz is underrated, could lift stock. I’m bullish despite Q1 miss."
"April 12, 2025, 16:20 PDT","$TSLA’s stock is a rollercoaster, down 2% today. Musk’s DOGE role keeps spooking investors."
"April 13, 2025, 08:40 PDT","$TSLA earnings next week, expecting pain but priced in. Stock could pop on AI updates."
"April 13, 2025, 12:55 PDT","$TSLA’s brand crisis is real, sales dropping fast. Bearish until Musk fixes the narrative."
"April 14, 2025, 07:30 PDT","$TSLA’s technicals show a double bottom, could rally soon. I’m buying for a swing trade."
"April 14, 2025, 15:10 PDT","$TSLA’s Q1 delivery miss still stings, stock’s flat. Need big news to break this range."
"April 15, 2025, 09:20 PDT","$TSLA’s stock is holding $240 support, looks promising. Bullish if it breaks $260 soon."
"April 15, 2025, 13:45 PDT","$TSLA’s China sales are slipping, competition’s fierce. Bearish unless they cut costs fast."
"April 16, 2025, 01:55 PDT","$TSLA down 2.1% premarket, tariffs on Chinese parts hit hard. Cybercab plans in trouble."
"April 16, 2025, 06:32 PDT","Tariffs hammer $TSLA again, down 2.5%. Supply chain issues could tank stock further."
"April 17, 2025, 08:50 PDT","$TSLA’s tariff hit is overblown, stock’s oversold. I’m buying for a rebound to $270."
"April 17, 2025, 14:30 PDT","$TSLA’s brand damage from Musk’s politics is real. Stock’s stuck until sentiment shifts."
"April 18, 2025, 10:00 PDT","$TSLA’s AI focus could save the stock, but Q1 was ugly. Neutral, waiting for earnings."
"April 18, 2025, 16:15 PDT","$TSLA’s stock is too volatile for me, down 3% today. Bearish until earnings clear the air."
"April 19, 2025, 11:25 PDT","$TSLA’s downtrend hits $237 resistance, looks bad. Earnings could push it to $200."
"April 19, 2025, 17:23 PDT","$TSLA’s rejected at $237, earnings Tuesday’s key. I’m shorting for a deeper drop."
"April 20, 2025, 12:10 PDT","Retail’s buying $TSLA dips hard before earnings. Risky, but could pay off if AI shines."
"April 20, 2025, 15:56 PDT","$TSLA’s sales and brand issues are piling up. Retail’s bullish, but I’m staying out."
"April 21, 2025, 05:38 PDT","$TSLA down 5.75% today, Q1 earnings fears kicking in. Stock’s braced for a rough ride."
"April 21, 2025, 09:46 PDT","Traders bet on 9.7% $TSLA swing post-earnings. Stock’s down 6% on weak Q1 results."
"April 22, 2025, 18:32 PDT","$TSLA earnings miss was brutal, profit down 71%. Still holding for robotaxi and AI."
"April 22, 2025, 20:14 PDT","$TSLA up 10% after-hours, Musk’s focus on Tesla sparks hope. Cheaper Model Y on track."
"April 23, 2025, 06:14 PDT","$TSLA’s not just a car stock, it’s an AI play. Q1 miss doesn’t shake my bullish view."
"April 23, 2025, 17:29 PDT","$TSLA failed $260 again, but $250 held. Needs to break $256 to avoid more downside."
"April 24, 2025, 10:42 PDT","$TSLA sounds alarm in Canada, prices up pre-tariff. Stock’s up 3.5%, smart move."
"April 24, 2025, 20:46 PDT","$TSLA at $259.51, predicting $300 by April 30. Bullish momentum building fast."
"April 25, 2025, 06:18 PDT","$TSLA closed at $284.95, up 9.8% on self-driving rule news. Bullish outlook strong."
"April 25, 2025, 10:02 PDT","$TSLA soars on India launch hopes and self-driving rules. What’s fueling this surge?"
"April 26, 2025, 09:15 PDT","$TSLA’s trading above 50-day MA, five-day win streak. Bullish, but earnings loom large."
"April 26, 2025, 21:05 PDT","$TSLA above 50-day MA, unlike other tech giants. Still below 200-day, mixed signals."
"April 27, 2025, 08:58 PDT","Double bottom breakout scans look great for $TSLA. Stock’s primed for a rally soon."
"April 27, 2025, 10:01 PDT","Tesla’s hiring 83 for Semi, production starts EOY. $TSLA’s Semi could lift stock."
"April 28, 2025, 08:14 PDT","Cantor’s bullish on $TSLA, sees near-term catalysts. Model Y refresh could spark gains."
"April 28, 2025, 09:01 PDT","$TSLA rally may stall unless Musk tones down politics. Brand risks dragging stock down."
"April 29, 2025, 09:30 PDT","$TSLA holding $285, volatility’s wild but bullish. Self-driving news keeps momentum up."
"April 29, 2025, 11:45 PDT","$TSLA’s AI bets are overhyped, stock’s overvalued. Bearish until earnings prove growth."
"March 1, 2025, 08:00 PDT","$TSLA up 2% to $340.10, Cybertruck delivery ramp excites. Bullish despite tariff risks."
"March 1, 2025, 12:30 PDT","Tariffs could hit $TSLA’s China exports, stock at $340. Bearish short-term, holding."
"March 2, 2025, 07:45 PDT","$TSLA surges 5% to $357.00, Musk’s AI bot hype. Bullish for $400 by Q2."
"March 2, 2025, 14:00 PDT","$TSLA’s stock at $357, overbought with RSI at 75. Neutral, waiting for pullback."
"March 3, 2025, 09:10 PDT","$TSLA down 3% to $346.00, tariff fears return. I’m buying for Robotaxi upside."
"March 3, 2025, 15:20 PDT","$TSLA’s stock at $346, support at $330. Bullish if it holds, eyeing $360."
"March 4, 2025, 08:15 PDT","$TSLA flat at $346, no major news. Neutral, focus on Q1 delivery numbers."
"March 4, 2025, 13:40 PDT","$TSLA’s $2.2B Q1 cash flow solid, stock at $346. Bullish on FSD progress."
"March 5, 2025, 10:00 PDT","$TSLA down 4% to $332.00, China demand concerns. Bearish until Q1 results."
"March 5, 2025, 16:10 PDT","$TSLA’s stock at $332, oversold. Bullish for a bounce to $350 soon."
"March 6, 2025, 08:30 PDT","$TSLA up 3% to $342.00, Nevada Semi production news. Bullish for $380."
"March 6, 2025, 14:05 PDT","$TSLA’s stock at $342, tariff risks cap gains. Neutral, waiting for clarity."
"March 7, 2025, 09:00 PDT","$TSLA jumps 6% to $362.50, Q1 delivery beat rumors. Bullish for $400."
"March 7, 2025, 15:30 PDT","$TSLA’s stock at $363, volatile on trade news. Bearish short-term, holding."
"March 8, 2025, 08:20 PDT","$TSLA’s stock at $363, FSD adoption grows. Bullish for $420 long-term."
"March 8, 2025, 14:45 PDT","$TSLA flat at $363, market’s cautious. Neutral, need Q1 confirmation."
"March 9, 2025, 09:15 PDT","$TSLA down 2% to $355.50, tariff talks intensify. I’m holding for AI."
"March 9, 2025, 15:00 PDT","$TSLA’s stock at $356, support at $350. Bullish if it breaks $370."
"March 10, 2025, 08:40 PDT","$TSLA up 1% to $359.00, Cybertruck orders soar. Bullish for $390."
"March 10, 2025, 13:50 PDT","$TSLA’s stock at $359, China risks linger. Bearish until tariff relief."
"March 11, 2025, 09:05 PDT","$TSLA flat at $359, no clear driver. Neutral, waiting for Q1 results."
"March 11, 2025, 14:25 PDT","$TSLA’s Q1 production down 16% YoY, stock at $359. Bullish on margins."
"March 12, 2025, 08:55 PDT","$TSLA down 3% to $348.00, tech sector weak. I’m buying for $380."
"March 12, 2025, 14:10 PDT","$TSLA’s stock at $348, oversold pre-earnings. Bullish for a rally."
"March 13, 2025, 09:30 PDT","$TSLA up 4% to $362.00, tariff optimism lifts. Bullish for $400."
"March 13, 2025, 15:15 PDT","$TSLA’s stock at $362, volatile on news. Neutral, focus on Q1 beat."
"March 14, 2025, 08:25 PDT","$TSLA flat at $362, Q1 earnings in focus. Bullish if EPS beats $0.85."
"March 14, 2025, 14:35 PDT","$TSLA’s stock at $362, tariff risks remain. Bearish short-term."
"March 15, 2025, 09:20 PDT","$TSLA’s stock at $362, Semi production ramps. Bullish for $410."
"March 15, 2025, 15:40 PDT","$TSLA flat at $362, no catalyst. Neutral, waiting for earnings."
"March 16, 2025, 08:50 PDT","$TSLA up 2% to $369.00, AI bot demo rumors. Bullish for $430."
"March 16, 2025, 14:20 PDT","$TSLA’s stock at $369, high P/E worries. Neutral, need Q1 clarity."
"March 17, 2025, 09:10 PDT","$TSLA down 1% to $365.00, China demand soft. Bearish until Q1."
"March 17, 2025, 14:55 PDT","$TSLA’s stock at $365, oversold. Bullish for a bounce to $380."
"March 18, 2025, 08:45 PDT","$TSLA up 3% to $376.00, Musk’s FSD tweet. Bullish for $420."
"March 18, 2025, 15:05 PDT","$TSLA’s stock at $376, tariff fears persist. Neutral, waiting for Q1."
"March 19, 2025, 09:00 PDT","$TSLA flat at $376, market’s quiet. Bullish on AI long-term."
"March 19, 2025, 14:30 PDT","$TSLA’s stock at $376, China risks weigh. Bearish short-term."
"March 20, 2025, 08:35 PDT","$TSLA down 2% to $368.00, tech sell-off. I’m holding for $400."
"March 20, 2025, 13:45 PDT","$TSLA’s stock at $368, support at $360. Bullish if it holds."
"March 21, 2025, 09:25 PDT","$TSLA up 5% to $386.00, Q1 delivery optimism. Bullish for $450."
"March 21, 2025, 14:50 PDT","$TSLA’s stock at $386, overbought. Neutral, waiting for pullback."
"March 22, 2025, 08:40 PDT","$TSLA’s stock at $386, FSD regulatory win. Bullish for $470."
"March 22, 2025, 14:15 PDT","$TSLA flat at $386, tariff talks drag. Bearish short-term."
"March 23, 2025, 09:05 PDT","$TSLA down 3% to $374.00, China export fears. Neutral, holding."
"March 23, 2025, 15:20 PDT","$TSLA’s stock at $374, oversold. Bullish for a rally to $400."
"March 24, 2025, 08:30 PDT","$TSLA up 2% to $381.00, Semi production news. Bullish for $440."
"March 24, 2025, 14:00 PDT","$TSLA’s stock at $381, tariff risks cap upside. Neutral, waiting."
"March 25, 2025, 09:15 PDT","$TSLA flat at $381, Q1 earnings loom. Bullish if margins strong."
"March 25, 2025, 14:45 PDT","$TSLA’s stock at $381, China demand concerns. Bearish short-term."
"March 26, 2025, 08:50 PDT","$TSLA up 1% to $385.00, AI bot hype returns. Bullish for $460."
"March 26, 2025, 14:10 PDT","$TSLA’s stock at $385, volatile on trade news. Neutral, focus on Q1."
"March 27, 2025, 09:00 PDT","$TSLA down 2% to $377.00, tech sector soft. I’m buying for $420."
"March 27, 2025, 15:30 PDT","$TSLA’s stock at $377, oversold. Bullish for a bounce to $400."
"March 28, 2025, 08:25 PDT","$TSLA up 4% to $392.00, tariff relief hopes. Bullish for $480."
"March 28, 2025, 14:05 PDT","$TSLA’s stock at $392, overbought post-rally. Neutral, waiting for Q1."
"March 29, 2025, 09:10 PDT","$TSLA’s stock at $392, Cybertruck sales soar. Bullish for $500."
"March 29, 2025, 14:40 PDT","$TSLA flat at $392, market’s cautious. Neutral, need Q1 beat."
"March 30, 2025, 08:55 PDT","$TSLA down 1% to $388.00, tariff noise back. Bearish short-term."
"March 30, 2025, 14:20 PDT","$TSLA’s stock at $388, support at $380. Bullish if it holds."
"March 31, 2025, 09:05 PDT","$TSLA up 0.5% to $390.00, Q1 delivery anticipation. Bullish for $510."
"March 31, 2025, 12:15 PDT","$TSLA’s stock at $390, tariff risks linger. Neutral, waiting for Q1."